{
  "version": "cA-1.0-pro",
  "contract_version": "blux-ca-output-1.1",
  "fixture_id": "duplicate_paths",
  "engine": {
    "name": "blux-ca",
    "line": "cA-1.0-pro",
    "dataset_version": "cA-1.0-pro"
  },
  "request": {
    "policy_pack_id": "cA-pro",
    "policy_pack_version": "1.0",
    "profile_id": "default",
    "profile_version": null,
    "device": null
  },
  "artifact": {
    "format": "json",
    "content": {
      "kind": "multi-file",
      "files": [
        {
          "path": "src/dup.txt",
          "content": "first\n"
        },
        {
          "path": "src/dup.txt",
          "content": "second\n"
        }
      ]
    }
  },
  "artifact_kind": "multi-file",
  "mime_type": "application/json"
}
