{
  "version": "cA-1.0-pro",
  "contract_version": "blux-ca-output-1.1",
  "fixture_id": "profile_echo",
  "engine": {
    "name": "blux-ca",
    "line": "cA-1.0-pro",
    "dataset_version": "cA-1.0-pro"
  },
  "request": {
    "policy_pack_id": "cA-pro",
    "policy_pack_version": "1.0",
    "profile_id": "cpu",
    "profile_version": "1.0",
    "device": "cpu"
  },
  "artifact": {
    "format": "json",
    "content": {
      "profile_id": "cpu",
      "profile_version": "1.0",
      "device": "cpu"
    }
  },
  "artifact_kind": "json",
  "mime_type": "application/json"
}
