{
  "version": "cA-1.0-pro",
  "contract_version": "blux-ca-output-1.1",
  "fixture_id": "multi_file_artifact",
  "engine": {
    "name": "blux-ca",
    "line": "cA-1.0-pro",
    "dataset_version": "cA-1.0-pro"
  },
  "request": {
    "policy_pack_id": "cA-pro",
    "policy_pack_version": "1.0",
    "profile_id": "default",
    "profile_version": null,
    "device": null
  },
  "artifact": {
    "format": "json",
    "content": {
      "kind": "multi-file",
      "files": [
        {
          "path": "README.md",
          "content": "# Multi-file Fixture\n"
        },
        {
          "path": "src/app.py",
          "content": "print(\"hello\")\n"
        },
        {
          "path": "src/utils/helpers.py",
          "content": "def add(a, b):\n    return a + b\n"
        }
      ]
    }
  },
  "artifact_kind": "multi-file",
  "mime_type": "application/json"
}
