{
  "version": "cA-1.0-pro",
  "contract_version": "blux-ca-output-1.1",
  "fixture_id": "policy_pack_matrix",
  "engine": {
    "name": "blux-ca",
    "line": "cA-1.0-pro",
    "dataset_version": "cA-1.0-pro"
  },
  "request": {
    "policy_pack_id": "cA-pro",
    "policy_pack_version": "1.0",
    "profile_id": "default",
    "profile_version": null,
    "device": null
  },
  "artifact": {
    "format": "json",
    "content": {
      "pack_id": "cA-pro",
      "decision": "allow",
      "rationale": "cA-pro permits the request under the broader pro policy limits."
    }
  },
  "artifact_kind": "json",
  "mime_type": "application/json"
}
